{"action_type":"A_validate","event":"plan_check","status":"ok","ts":"2026-05-26T15:06:31Z","warnings":[]}
{"action_type":"A_validate","event":"plan_check","status":"ok","ts":"2026-05-26T20:27:34Z","warnings":[]}
{"commit":"07dddd2c27a233ad023941dc05d064426565bb62","event":"review_finalize","halt_loop":false,"mandatory_gate_reason":"mandatory_tools: missing normalized tool(s) ['runner.tools.anomaly', 'runner.tools.bootstrap_ci'] (spec \u00a78.3 item 8)","noise_floor_override":null,"should_rollback":true,"ts":"2026-05-26T20:37:15Z","verdict":"malformed"}
{"commit":"07dddd2c27a233ad023941dc05d064426565bb62","event":"review_finalize","halt_loop":false,"mandatory_gate_reason":null,"noise_floor_override":null,"should_rollback":false,"ts":"2026-05-26T20:37:26Z","verdict":"keep"}
{"action_type":"A_validate","event":"plan_check","status":"ok","ts":"2026-05-26T20:38:25Z","warnings":[]}
{"commit":"749c93f00aceb74bcb4a99d41e2fdbfc3fb332e2","event":"review_finalize","halt_loop":false,"mandatory_gate_reason":null,"noise_floor_override":"noise_floor_gate: delta=-3.1414 < noise_floor=0.3 \u2014 mechanical override from keep\u2192discard","should_rollback":true,"ts":"2026-05-26T20:42:29Z","verdict":"discard"}
{"action_type":"A_feature","event":"plan_check","status":"ok","ts":"2026-05-26T20:44:45Z","warnings":[]}
{"commit":"a4f14a469b77158367c73496e50f61f79f7251b3","event":"review_finalize","halt_loop":false,"mandatory_gate_reason":null,"noise_floor_override":null,"should_rollback":false,"ts":"2026-05-26T20:57:51Z","verdict":"keep"}
{"action_type":"A_feature","event":"plan_check","status":"ok","ts":"2026-05-26T20:58:51Z","warnings":[]}
{"commit":"7284b9e488db4e178556d25422c48584044363e4","event":"review_finalize","halt_loop":false,"mandatory_gate_reason":null,"noise_floor_override":null,"should_rollback":true,"ts":"2026-05-26T21:10:12Z","verdict":"discard"}
{"commit":"399166ac3b8a3e0136009e004dbc8e817cb41c1d","event":"review_finalize","halt_loop":false,"mandatory_gate_reason":null,"noise_floor_override":null,"should_rollback":true,"ts":"2026-05-26T21:38:45Z","verdict":"discard"}
{"commit":"1c785c9e8b3f1d88f9fd4899e002a72a2da6a2a9","event":"review_finalize","halt_loop":false,"mandatory_gate_reason":null,"noise_floor_override":null,"should_rollback":true,"ts":"2026-05-26T22:53:18Z","verdict":"discard"}
{"commit":"d0489bcf0eb63a58d08727caf19e6ed0b14fe59e","event":"review_finalize","halt_loop":false,"mandatory_gate_reason":null,"noise_floor_override":null,"should_rollback":true,"ts":"2026-05-26T23:29:47Z","verdict":"discard"}
{"commit":"05422c4f164e6e69c65d4ad58fcedf3ed6056982","event":"review_finalize","halt_loop":false,"mandatory_gate_reason":null,"noise_floor_override":null,"should_rollback":false,"ts":"2026-05-26T23:36:31Z","verdict":"keep"}
{"commit":"fae4ed0d1391a0ddb8af9ca91d84b2a3021ab3fd","event":"review_finalize","halt_loop":false,"mandatory_gate_reason":null,"noise_floor_override":null,"should_rollback":true,"ts":"2026-05-26T23:43:53Z","verdict":"discard"}
{"commit":"112207ab9519383ca883d33c077fdae46e5635ad","event":"review_finalize","halt_loop":false,"mandatory_gate_reason":null,"noise_floor_override":null,"should_rollback":true,"ts":"2026-05-26T23:51:28Z","verdict":"discard"}
{"commit":"8630caec7e4381a93f45855c329e193a09bc3e84","event":"review_finalize","halt_loop":false,"mandatory_gate_reason":null,"noise_floor_override":null,"should_rollback":true,"ts":"2026-05-26T23:57:09Z","verdict":"discard"}
{"commit":"c997a60391fd31ee2118b3f4eb8b15c536ff0d60","event":"review_finalize","halt_loop":false,"mandatory_gate_reason":null,"noise_floor_override":"noise_floor_gate: delta=0.2060 < noise_floor=0.3 \u2014 mechanical override from keep\u2192discard","should_rollback":true,"ts":"2026-05-27T01:32:36Z","verdict":"discard"}
{"commit":"b8ee5c4578f1f78fcdecb98e815068d84c911d0d","event":"review_finalize","halt_loop":false,"mandatory_gate_reason":null,"noise_floor_override":"noise_floor_gate: delta=0.2575 < noise_floor=0.3 \u2014 mechanical override from keep\u2192discard","should_rollback":true,"ts":"2026-05-27T01:56:13Z","verdict":"discard"}
{"commit":"abcf92a21accc70e49b2087e4f5d1d48c509f4fa","event":"review_finalize","halt_loop":false,"mandatory_gate_reason":null,"noise_floor_override":"noise_floor_gate: delta=0.1030 < noise_floor=0.3 \u2014 mechanical override from keep\u2192discard","should_rollback":true,"ts":"2026-05-27T02:19:24Z","verdict":"discard"}
{"commit":"294e2ec22ce90d60e782f6f20c4f2efb293ed43e","event":"review_finalize","halt_loop":false,"mandatory_gate_reason":null,"noise_floor_override":"noise_floor_gate: delta=0.0858 < noise_floor=0.3 \u2014 mechanical override from keep\u2192discard","should_rollback":true,"ts":"2026-05-27T02:39:42Z","verdict":"discard"}
{"commit":"3f7e510de5e8cf4f7c04df8ef4ffc2c0c07a29ff","event":"review_finalize","halt_loop":false,"mandatory_gate_reason":null,"noise_floor_override":"noise_floor_gate: delta=0.0000 < noise_floor=0.3 \u2014 mechanical override from keep\u2192discard","should_rollback":true,"ts":"2026-05-27T02:56:22Z","verdict":"discard"}
{"commit":"69fa263143fe2ffb7e9a781d5a03efdd3ee7336b","event":"review_finalize","halt_loop":false,"mandatory_gate_reason":null,"noise_floor_override":null,"should_rollback":false,"ts":"2026-05-27T03:16:16Z","verdict":"keep"}
