{"action_type":"A_model","event":"plan_check","status":"ok","ts":"2026-06-20T13:34:21Z","warnings":[]}
{"args_hash":"ecc0be239b52647a","campaign_dir":"campaigns/p0-fix-validation-h","end_ts":"2026-06-20T13:35:36Z","event":"tool_run","exit_code":2,"name":"runner.tools.anomaly","round":0,"start_ts":"2026-06-20T13:35:36Z","ts":"2026-06-20T13:35:36Z"}
{"args_hash":"8b4a9220111ddc5e","campaign_dir":"campaigns/p0-fix-validation-h","end_ts":"2026-06-20T13:35:44Z","event":"tool_run","exit_code":2,"name":"runner.tools.anomaly","round":0,"start_ts":"2026-06-20T13:35:44Z","ts":"2026-06-20T13:35:44Z"}
{"args_hash":"cf978390b985fa66","campaign_dir":"campaigns/p0-fix-validation-h","end_ts":"2026-06-20T13:35:51Z","event":"tool_run","exit_code":0,"name":"runner.tools.anomaly","round":0,"start_ts":"2026-06-20T13:35:51Z","ts":"2026-06-20T13:35:51Z"}
{"args_hash":"5b5f7838fe610a01","campaign_dir":"campaigns/p0-fix-validation-h","end_ts":"2026-06-20T13:37:06Z","event":"tool_run","exit_code":0,"name":"runner.tools.bootstrap_ci","round":0,"start_ts":"2026-06-20T13:37:05Z","ts":"2026-06-20T13:37:06Z"}
{"commit":"d20e21769bf720b89f011ba346644ea2d1d47063","event":"review_finalize","halt_loop":false,"mandatory_gate_reason":null,"noise_floor_override":null,"should_rollback":false,"ts":"2026-06-20T13:38:57Z","verdict":"keep"}
{"action_type":"A_model","event":"plan_check","status":"ok","ts":"2026-06-20T13:40:49Z","warnings":[]}
{"args_hash":"3699e140c15a47f8","campaign_dir":"campaigns/p0-fix-validation-h","end_ts":"2026-06-20T13:41:51Z","event":"tool_run","exit_code":0,"name":"runner.tools.anomaly","round":1,"start_ts":"2026-06-20T13:41:51Z","ts":"2026-06-20T13:41:51Z"}
{"args_hash":"5b5f7838fe610a01","campaign_dir":"campaigns/p0-fix-validation-h","end_ts":"2026-06-20T13:41:56Z","event":"tool_run","exit_code":0,"name":"runner.tools.bootstrap_ci","round":1,"start_ts":"2026-06-20T13:41:55Z","ts":"2026-06-20T13:41:56Z"}
{"commit":"032ef35633d2bea93cc1ca2f195932d27425cd6a","event":"review_finalize","halt_loop":false,"mandatory_gate_reason":null,"noise_floor_override":null,"should_rollback":true,"ts":"2026-06-20T13:43:23Z","verdict":"discard"}
{"assumptions_flagged":0,"event":"historian_finalize","patterns_added":0,"round":2,"tokens_used":3840,"trigger":"periodic","ts":"2026-06-20T13:45:44Z","verified":true}
{"action_type":"A_hp","event":"plan_check","status":"ok","ts":"2026-06-20T13:47:12Z","warnings":[]}
{"args_hash":"d5353442410ea2ed","campaign_dir":"campaigns/p0-fix-validation-h","end_ts":"2026-06-20T13:49:44Z","event":"tool_run","exit_code":0,"name":"runner.tools.anomaly","round":2,"start_ts":"2026-06-20T13:49:44Z","ts":"2026-06-20T13:49:44Z"}
{"args_hash":"5b5f7838fe610a01","campaign_dir":"campaigns/p0-fix-validation-h","end_ts":"2026-06-20T13:49:56Z","event":"tool_run","exit_code":0,"name":"runner.tools.bootstrap_ci","round":2,"start_ts":"2026-06-20T13:49:55Z","ts":"2026-06-20T13:49:56Z"}
{"commit":"4b0f4aa09839e67b64204c1c38371e3ed35baa52","event":"review_finalize","halt_loop":false,"mandatory_gate_reason":null,"noise_floor_override":null,"should_rollback":true,"ts":"2026-06-20T13:51:21Z","verdict":"discard"}
{"action_type":"A_hp","event":"plan_check","status":"ok","ts":"2026-06-20T13:53:12Z","warnings":[]}
{"args_hash":"bc498478bc82a8a7","campaign_dir":"campaigns/p0-fix-validation-h","end_ts":"2026-06-20T13:54:26Z","event":"tool_run","exit_code":0,"name":"runner.tools.anomaly","round":3,"start_ts":"2026-06-20T13:54:26Z","ts":"2026-06-20T13:54:26Z"}
{"args_hash":"5b5f7838fe610a01","campaign_dir":"campaigns/p0-fix-validation-h","end_ts":"2026-06-20T13:54:31Z","event":"tool_run","exit_code":0,"name":"runner.tools.bootstrap_ci","round":3,"start_ts":"2026-06-20T13:54:30Z","ts":"2026-06-20T13:54:31Z"}
{"commit":"2eeebcbe98963d5a36ce614d4c62f3efb456f97c","event":"review_finalize","halt_loop":true,"mandatory_gate_reason":null,"noise_floor_override":null,"should_rollback":false,"ts":"2026-06-20T13:58:14Z","verdict":"keep"}
